URL,Version,Status,OIDs,Name,Title,Descriptino,Uses,Used,Sources
http://hl7.org/fhir/ValueSet/administrative-gender,4.0.1,active,"2.16.840.1.113883.4.642.3.1",AdministrativeGender,AdministrativeGender,"The gender of a person used for administrative purposes.","StructureDefinition/AuditEventNorwayPractitioner","hl7.fhir.r4.core"
http://hl7.org/fhir/ValueSet/audit-entity-type,4.0.1,draft,"2.16.840.1.113883.4.642.3.458",AuditEventEntityType,Audit event entity type,"Code for the entity type involved in the audit event.","StructureDefinition/AuditEventNorwayTokenProfile,StructureDefinition/AuditEventNorwayTokenProfileConsumer","THO,hl7.fhir.r4.core"
http://hl7.org/fhir/ValueSet/audit-event-action,4.0.1,draft,"2.16.840.1.113883.4.642.3.452",AuditEventAction,AuditEventAction,"Indicator for type of action performed during the event that generated the event.","StructureDefinition/AuditEventNorwayTokenProfile,StructureDefinition/AuditEventNorwayTokenProfileConsumer","hl7.fhir.r4.core"
http://hl7.org/fhir/ValueSet/audit-event-outcome,4.0.1,draft,"2.16.840.1.113883.4.642.3.454",AuditEventOutcome,AuditEventOutcome,"Indicates whether the event succeeded or failed.","StructureDefinition/AuditEventNorwayTokenProfile,StructureDefinition/AuditEventNorwayTokenProfileConsumer","hl7.fhir.r4.core"
http://hl7.org/fhir/ValueSet/audit-event-sub-type,4.0.1,active,"2.16.840.1.113883.4.642.3.464",AuditEventSub-Type,Audit Event Sub-Type,"More detailed code concerning the type of the audit event - defined by DICOM with some FHIR specific additions.","StructureDefinition/AuditEventNorwayTokenProfile,StructureDefinition/AuditEventNorwayTokenProfileConsumer","DICOM,hl7.fhir.r4.core"
http://hl7.org/fhir/ValueSet/audit-event-type,4.0.1,active,"2.16.840.1.113883.4.642.3.462",AuditEventID,Audit Event ID,"Event Types for Audit Events - defined by DICOM with some FHIR specific additions.","StructureDefinition/AuditEventNorwayTokenProfile,StructureDefinition/AuditEventNorwayTokenProfileConsumer","THO,DICOM"
http://hl7.org/fhir/ValueSet/audit-source-type,4.0.1,active,"2.16.840.1.113883.4.642.3.466",AuditEventSourceType,Audit Event Source Type,"The type of process where the audit event originated from.","StructureDefinition/AuditEventNorwayTokenProfile,StructureDefinition/AuditEventNorwayTokenProfileConsumer","THO"
http://hl7.org/fhir/ValueSet/c80-practice-codes,4.0.1,active,"2.16.840.1.113883.3.88.12.80.72",PracticeSettingCodeValueSet,Practice Setting Code Value Set,"This is the code representing the clinical specialty of the clinician or provider who interacted with, treated, or provided a service to/for the patient. The value set used for clinical specialty has been limited by HITSP to the value set reproduced from HITSP C80 Table 2-149 Clinical Specialty Value Set Definition.","StructureDefinition/AuditEventNorwayPractitionerRole","SCT"
http://hl7.org/fhir/ValueSet/contactentity-type,4.0.1,draft,"2.16.840.1.113883.4.642.3.416",ContactEntityType,Contact entity type,"This example value set defines a set of codes that can be used to indicate the purpose for which you would contact a contact party.","StructureDefinition/AuditEventNorwayPractitionerLocationOrganization,StructureDefinition/AuditEventNorwayOrganization","THO"
http://hl7.org/fhir/ValueSet/days-of-week,4.0.1,active,"2.16.840.1.113883.4.642.3.512",DaysOfWeek,DaysOfWeek,"The days of the week.","StructureDefinition/AuditEventNorwayPractitionerRole,StructureDefinition/AuditEventNorwayPractitionerLocation","hl7.fhir.r4.core"
http://hl7.org/fhir/ValueSet/dicm-405-mediatype,4.0.1,active,"1.2.840.10008.6.​1.​908",MediaTypeCode,Media Type Code,"Media Type Code","StructureDefinition/AuditEventNorwayTokenProfile,StructureDefinition/AuditEventNorwayTokenProfileConsumer","DICOM"
http://hl7.org/fhir/ValueSet/identifier-type,4.0.1,active,"2.16.840.1.113883.4.642.3.45",Identifier Type Codes,IdentifierType,"A coded type for an identifier that can be used to determine which identifier to use for a specific purpose.","StructureDefinition/AuditEventNorwayTokenProfile,StructureDefinition/AuditEventNorwayTokenProfileConsumer","THO (V2)"
http://hl7.org/fhir/ValueSet/identifier-use,4.0.1,active,"2.16.840.1.113883.4.642.3.57",IdentifierUse,IdentifierUse,"Identifies the purpose for this identifier, if known .","StructureDefinition/AuditEventNorwayTokenProfile,StructureDefinition/AuditEventNorwayTokenProfileConsumer","hl7.fhir.r4.core"
http://hl7.org/fhir/ValueSet/languages,4.0.1,draft,"2.16.840.1.113883.4.642.3.20",CommonLanguages,Common Languages,"This value set includes common codes from BCP-47 (http://tools.ietf.org/html/bcp47)","StructureDefinition/AuditEventNorwayPractitioner,StructureDefinition/AuditEventNorwayTokenProfile,StructureDefinition/AuditEventNorwayTokenProfileConsumer,StructureDefinition/AuditEventNorwayPractitionerRole,StructureDefinition/AuditEventNorwayPractitionerLocation,StructureDefinition/AuditEventNorwayPractitionerLocationOrganization,StructureDefinition/AuditEventNorwayOrganization","hl7.terminology.r4"
http://hl7.org/fhir/ValueSet/location-mode,4.0.1,draft,"2.16.840.1.113883.4.642.3.330",LocationMode,LocationMode,"Indicates whether a resource instance represents a specific location or a class of locations.","StructureDefinition/AuditEventNorwayPractitionerLocation","hl7.fhir.r4.core"
http://hl7.org/fhir/ValueSet/location-physical-type,4.0.1,draft,"2.16.840.1.113883.4.642.3.328",LocationType,Location type,"This example value set defines a set of codes that can be used to indicate the physical form of the Location.","StructureDefinition/AuditEventNorwayPractitionerLocation","THO"
http://hl7.org/fhir/ValueSet/location-status,4.0.1,draft,"2.16.840.1.113883.4.642.3.332",LocationStatus,LocationStatus,"Indicates whether the location is still in use.","StructureDefinition/AuditEventNorwayPractitionerLocation","hl7.fhir.r4.core"
http://hl7.org/fhir/ValueSet/network-type,4.0.1,draft,"2.16.840.1.113883.4.642.3.456",AuditEventAgentNetworkType,AuditEventAgentNetworkType,"The type of network access point of this agent in the audit event.","StructureDefinition/AuditEventNorwayTokenProfile,StructureDefinition/AuditEventNorwayTokenProfileConsumer","hl7.fhir.r4.core"
http://hl7.org/fhir/ValueSet/object-lifecycle-events,4.0.1,draft,,ObjectLifecycleEvents,null,"This example FHIR value set is comprised of lifecycle event codes. The FHIR Actor value set is based on    DICOM Audit Message, ParticipantObjectDataLifeCycle;   ISO Standard, TS 21089-2017;  ","StructureDefinition/AuditEventNorwayTokenProfile,StructureDefinition/AuditEventNorwayTokenProfileConsumer","THO"
http://hl7.org/fhir/ValueSet/object-role,4.0.1,draft,"2.16.840.1.113883.4.642.3.460",AuditEventEntityRole,AuditEventEntityRole,"Code representing the role the entity played in the audit event.","StructureDefinition/AuditEventNorwayTokenProfile,StructureDefinition/AuditEventNorwayTokenProfileConsumer","THO"
http://hl7.org/fhir/ValueSet/organization-type,4.0.1,draft,"2.16.840.1.113883.4.642.3.414",OrganizationType,Organization type,"This example value set defines a set of codes that can be used to indicate a type of organization.","StructureDefinition/AuditEventNorwayPractitionerLocationOrganization,StructureDefinition/AuditEventNorwayOrganization","THO"
http://hl7.org/fhir/ValueSet/participation-role-type,4.0.1,draft,"2.16.840.1.113883.4.642.3.54",ParticipationRoleType,ParticipationRoleType,"This FHIR value set is comprised of Actor participation Type codes, which can be used to value FHIR agents, actors, and other role         elements. The FHIR Actor participation type value set is based on    DICOM Audit Message, C402;   ASTM Standard, E1762-95 [2013]; selected codes and          derived actor roles from HL7 RoleClass OID 2.16.840.1.113883.5.110;    HL7 Role Code 2.16.840.1.113883.5.111, including AgentRoleType;          HL7 ParticipationType OID: 2.16.840.1.113883.5.90; and    HL7 ParticipationFunction codes OID: 2.16.840.1.113883.5.88.           This value set includes, by reference, role codes from external code systems: NUCC Health Care Provider Taxonomy OID: 2.16.840.1.113883.6.101;          North American Industry Classification System [NAICS]OID: 2.16.840.1.113883.6.85; IndustryClassificationSystem 2.16.840.1.113883.1.11.16039;          and US Census Occupation Code OID: 2.16.840.1.113883.6.243 for relevant recipient or custodian codes not included in this value set.            If no source is indicated in the definition comments, then these are example FHIR codes.","StructureDefinition/AuditEventNorwayTokenProfile,StructureDefinition/AuditEventNorwayTokenProfileConsumer","THO (V3),THO,DICOM"
http://hl7.org/fhir/ValueSet/practitioner-role,4.0.1,draft,"2.16.840.1.113883.4.642.3.439",PractitionerRole,Practitioner role,"This example value set defines a set of codes that can be used to indicate the role of a Practitioner.","StructureDefinition/AuditEventNorwayPractitionerRole","SCT,THO"
http://hl7.org/fhir/ValueSet/resource-types,5.0.0,active,"2.16.840.1.113883.4.642.3.27",ResourceType,Resource Types,"Concrete FHIR Resource Types","StructureDefinition/AuditEventNorwayTokenProfile,StructureDefinition/AuditEventNorwayTokenProfileConsumer","FHIR"
http://hl7.org/fhir/ValueSet/security-labels,4.0.1,active,"2.16.840.1.113883.4.642.3.47",All Security Labels,SecurityLabels,"A single value set for all security labels defined by FHIR.","StructureDefinition/AuditEventNorwayTokenProfile,StructureDefinition/AuditEventNorwayTokenProfileConsumer",
http://hl7.org/fhir/ValueSet/security-role-type,4.0.1,draft,"2.16.840.1.113883.4.642.3.978",SecurityRoleType,SecurityRoleType,"This example FHIR value set is comprised of example Actor Type codes, which can be used to value FHIR agents, actors, and other role         elements such as those specified in financial transactions. The FHIR Actor value set is based on    DICOM Audit Message, C402;   ASTM Standard, E1762-95 [2013]; selected codes and          derived actor roles from HL7 RoleClass OID 2.16.840.1.113883.5.110;    HL7 Role Code 2.16.840.1.113883.5.111, including AgentRoleType;          HL7 ParticipationType OID: 2.16.840.1.113883.5.90; and    HL7 ParticipationFunction codes OID: 2.16.840.1.113883.5.88.           This value set includes, by reference, role codes from external code systems: NUCC Health Care Provider Taxonomy OID: 2.16.840.1.113883.6.101;          North American Industry Classification System [NAICS]OID: 2.16.840.1.113883.6.85; IndustryClassificationSystem 2.16.840.1.113883.1.11.16039;          and US Census Occupation Code OID: 2.16.840.1.113883.6.243 for relevant recipient or custodian codes not included in this value set.            If no source is indicated in the definition comments, then these are example FHIR codes.          It can be extended with appropriate roles described by SNOMED as well as those described in the HL7 Role Based Access Control Catalog and the          HL7 Healthcare (Security and Privacy) Access Control Catalog.            In Role-Based Access Control (RBAC), permissions are operations on an object that a user wishes to access. Permissions are grouped into roles.          A role characterizes the functions a user is allowed to perform. Roles are assigned to users. If the user's role has the appropriate permissions          to access an object, then that user is granted access to the object. FHIR readily enables RBAC, as FHIR Resources are object types and the CRUDE          events (the FHIR equivalent to permissions in the RBAC scheme) are operations on those objects.          In Attribute-Based Access Control (ABAC), a user requests to perform operations on objects. That user's access request is granted or denied          based on a set of access control policies that are specified in terms of attributes and conditions. FHIR readily enables ABAC, as instances of          a Resource in FHIR (again, Resources are object types) can have attributes associated with them. These attributes include security tags,          environment conditions, and a host of user and object characteristics, which are the same attributes as those used in ABAC. Attributes help          define the access control policies that determine the operations a user may perform on a Resource (in FHIR) or object (in ABAC). For example,          a tag (or attribute) may specify that the identified Resource (object) is not to be further disclosed without explicit consent from the patient.","StructureDefinition/AuditEventNorwayTokenProfile,StructureDefinition/AuditEventNorwayTokenProfileConsumer","THO (V3),THO,DICOM"
http://terminology.hl7.org/ValueSet/v2-0116,2.0.0,active,"2.16.840.1.113883.21.51",Hl7VSBedStatus,hl7VS-bedStatus,"Value Set of codes that specify the state of a bed in an inpatient setting, and is used to determine if a patient may be assigned to it or not.","StructureDefinition/AuditEventNorwayPractitionerLocation","THO (V2)"
http://terminology.hl7.org/ValueSet/v2-2.7-0360,0360,active,,v2.0360.2.7,v2 table 0360, Version 2.7,"FHIR Value set/code system definition for HL7 v2 table 0360 ver 2.9 ( Degree/License/Certificate)","StructureDefinition/AuditEventNorwayPractitioner","THO (V2)"
http://terminology.hl7.org/ValueSet/v3-PurposeOfUse,2.0.0,active,"2.16.840.1.113883.1.11.20448",PurposeOfUse,PurposeOfUse,"Supports communication of purpose of use at a general level.","StructureDefinition/AuditEventNorwayTokenProfile,StructureDefinition/AuditEventNorwayTokenProfileConsumer","THO (V3)"
http://terminology.hl7.org/ValueSet/v3-ServiceDeliveryLocationRoleType,2.0.0,active,"2.16.840.1.113883.1.11.17660",ServiceDeliveryLocationRoleType,ServiceDeliveryLocationRoleType,"A role of a place that further classifies the setting (e.g., accident site, road side, work site, community location) in which services are delivered.","StructureDefinition/AuditEventNorwayPractitionerLocation","THO (V3)"
